"No.","Time","Source","Destination","Protocol","Length","Info"
"1","0.000000000","127.0.0.1","127.0.0.1","TLSv1.2","125","Application Data"
"2","0.000022900","127.0.0.1","127.0.0.1","TCP","44","56384  >  56401 [ACK] Seq=1 Ack=82 Win=8272 Len=0"
"3","0.000124500","127.0.0.1","127.0.0.1","TLSv1.2","75","Application Data"
"4","0.000136900","127.0.0.1","127.0.0.1","TCP","44","56384  >  56401 [ACK] Seq=1 Ack=113 Win=8272 Len=0"
"5","0.000288900","127.0.0.1","127.0.0.1","TLSv1.2","105","Application Data"
"6","0.000306700","127.0.0.1","127.0.0.1","TCP","44","56401  >  56384 [ACK] Seq=113 Ack=62 Win=8388 Len=0"
"7","0.000335900","127.0.0.1","127.0.0.1","TLSv1.2","113","Application Data"
"8","0.000343600","127.0.0.1","127.0.0.1","TCP","44","56401  >  56384 [ACK] Seq=113 Ack=131 Win=8387 Len=0"
"9","0.947245300","127.0.0.1","127.0.0.1","TLSv1.2","170","Application Data"
"10","0.947268200","127.0.0.1","127.0.0.1","TCP","44","56051  >  50362 [ACK] Seq=1 Ack=127 Win=8410 Len=0"
"11","0.947562700","127.0.0.1","127.0.0.1","TLSv1.2","75","Application Data"
"12","0.947583200","127.0.0.1","127.0.0.1","TCP","44","56051  >  50362 [ACK] Seq=1 Ack=158 Win=8410 Len=0"
"13","0.947786000","127.0.0.1","127.0.0.1","TLSv1.2","105","Application Data"
"14","0.947803000","127.0.0.1","127.0.0.1","TCP","44","50362  >  56051 [ACK] Seq=158 Ack=62 Win=8244 Len=0"
"15","0.947857700","127.0.0.1","127.0.0.1","TLSv1.2","113","Application Data"
"16","0.947868900","127.0.0.1","127.0.0.1","TCP","44","50362  >  56051 [ACK] Seq=158 Ack=131 Win=8243 Len=0"
"17","1.000720300","127.0.0.1","127.0.0.1","TLSv1.2","125","Application Data"
"18","1.000742900","127.0.0.1","127.0.0.1","TCP","44","56384  >  56401 [ACK] Seq=131 Ack=194 Win=8272 Len=0"
"19","1.000850500","127.0.0.1","127.0.0.1","TLSv1.2","75","Application Data"
"20","1.000866200","127.0.0.1","127.0.0.1","TCP","44","56384  >  56401 [ACK] Seq=131 Ack=225 Win=8272 Len=0"
"21","1.001055200","127.0.0.1","127.0.0.1","TLSv1.2","105","Application Data"
"22","1.001069700","127.0.0.1","127.0.0.1","TCP","44","56401  >  56384 [ACK] Seq=225 Ack=192 Win=8387 Len=0"
"23","1.001093500","127.0.0.1","127.0.0.1","TLSv1.2","113","Application Data"
"24","1.001099600","127.0.0.1","127.0.0.1","TCP","44","56401  >  56384 [ACK] Seq=225 Ack=261 Win=8387 Len=0"
"25","1.745871800","127.0.0.1","127.0.0.1","TCP","45","56059  >  56049 [ACK] Seq=1 Ack=1 Win=1269 Len=1"
"26","1.745887100","127.0.0.1","127.0.0.1","TCP","56","56049  >  56059 [ACK] Seq=1 Ack=2 Win=8440 Len=0 SLE=1 SRE=2"
"27","1.745895800","127.0.0.1","127.0.0.1","TCP","45","56393  >  56383 [ACK] Seq=1 Ack=1 Win=1263 Len=1"
"28","1.745900400","127.0.0.1","127.0.0.1","TCP","56","56383  >  56393 [ACK] Seq=1 Ack=2 Win=8440 Len=0 SLE=1 SRE=2"
"29","2.006629800","127.0.0.1","127.0.0.1","TLSv1.2","125","Application Data"
"30","2.006658700","127.0.0.1","127.0.0.1","TCP","44","56384  >  56401 [ACK] Seq=261 Ack=306 Win=8271 Len=0"
"31","2.010336100","127.0.0.1","127.0.0.1","TLSv1.2","75","Application Data"
"32","2.010362100","127.0.0.1","127.0.0.1","TCP","44","56384  >  56401 [ACK] Seq=261 Ack=337 Win=8271 Len=0"
"33","2.011370900","127.0.0.1","127.0.0.1","TLSv1.2","105","Application Data"
"34","2.011402100","127.0.0.1","127.0.0.1","TCP","44","56401  >  56384 [ACK] Seq=337 Ack=322 Win=8387 Len=0"
"35","2.011687800","127.0.0.1","127.0.0.1","TLSv1.2","113","Application Data"
"36","2.011701000","127.0.0.1","127.0.0.1","TCP","44","56401  >  56384 [ACK] Seq=337 Ack=391 Win=8386 Len=0"
"37","3.008533000","127.0.0.1","127.0.0.1","TLSv1.2","125","Application Data"
"38","3.008576600","127.0.0.1","127.0.0.1","TCP","44","56384  >  56401 [ACK] Seq=391 Ack=418 Win=8271 Len=0"
"39","3.008731400","127.0.0.1","127.0.0.1","TLSv1.2","75","Application Data"
"40","3.008746200","127.0.0.1","127.0.0.1","TCP","44","56384  >  56401 [ACK] Seq=391 Ack=449 Win=8271 Len=0"
"41","3.009005800","127.0.0.1","127.0.0.1","TLSv1.2","105","Application Data"
"42","3.009022300","127.0.0.1","127.0.0.1","TCP","44","56401  >  56384 [ACK] Seq=449 Ack=452 Win=8386 Len=0"
"43","3.009082800","127.0.0.1","127.0.0.1","TLSv1.2","113","Application Data"
"44","3.009091200","127.0.0.1","127.0.0.1","TCP","44","56401  >  56384 [ACK] Seq=449 Ack=521 Win=8386 Len=0"
"45","3.660809200","127.0.0.1","127.0.0.1","TCP","45","55548  >  56049 [ACK] Seq=1 Ack=1 Win=1278 Len=1"
"46","3.660833100","127.0.0.1","127.0.0.1","TCP","56","56049  >  55548 [ACK] Seq=1 Ack=2 Win=8440 Len=0 SLE=1 SRE=2"
"47","4.008785100","127.0.0.1","127.0.0.1","TLSv1.2","125","Application Data"
"48","4.008807900","127.0.0.1","127.0.0.1","TCP","44","56384  >  56401 [ACK] Seq=521 Ack=530 Win=8271 Len=0"
"49","4.008898900","127.0.0.1","127.0.0.1","TLSv1.2","75","Application Data"
"50","4.008907800","127.0.0.1","127.0.0.1","TCP","44","56384  >  56401 [ACK] Seq=521 Ack=561 Win=8270 Len=0"
"51","4.009070600","127.0.0.1","127.0.0.1","TLSv1.2","105","Application Data"
"52","4.009084900","127.0.0.1","127.0.0.1","TCP","44","56401  >  56384 [ACK] Seq=561 Ack=582 Win=8386 Len=0"
"53","4.009106600","127.0.0.1","127.0.0.1","TLSv1.2","113","Application Data"
"54","4.009112400","127.0.0.1","127.0.0.1","TCP","44","56401  >  56384 [ACK] Seq=561 Ack=651 Win=8385 Len=0"
"55","5.068097700","127.0.0.1","127.0.0.1","TLSv1.2","125","Application Data"
"56","5.068120700","127.0.0.1","127.0.0.1","TCP","44","56384  >  56401 [ACK] Seq=651 Ack=642 Win=8270 Len=0"
"57","5.068269300","127.0.0.1","127.0.0.1","TLSv1.2","75","Application Data"
"58","5.068281600","127.0.0.1","127.0.0.1","TCP","44","56384  >  56401 [ACK] Seq=651 Ack=673 Win=8270 Len=0"
"59","5.068515100","127.0.0.1","127.0.0.1","TLSv1.2","105","Application Data"
"60","5.068534100","127.0.0.1","127.0.0.1","TCP","44","56401  >  56384 [ACK] Seq=673 Ack=712 Win=8385 Len=0"
"61","5.068564700","127.0.0.1","127.0.0.1","TLSv1.2","113","Application Data"
"62","5.068574000","127.0.0.1","127.0.0.1","TCP","44","56401  >  56384 [ACK] Seq=673 Ack=781 Win=8385 Len=0"
"63","5.624202200","127.0.0.1","127.0.0.1","TCP","56","51398  >  56049 [SYN] Seq=0 Win=65535 Len=0 MSS=65495 WS=256 SACK_PERM"
"64","5.624247400","127.0.0.1","127.0.0.1","TCP","56","56049  >  51398 [SYN, ACK] Seq=0 Ack=1 Win=65535 Len=0 MSS=65495 WS=256 SACK_PERM"
"65","5.624264000","127.0.0.1","127.0.0.1","TCP","44","51398  >  56049 [ACK] Seq=1 Ack=1 Win=327424 Len=0"
"66","5.624408800","127.0.0.1","127.0.0.1","HTTP","419","POST /exa.extension_server_pb.ExtensionServerService/GetChromeDevtoolsMcpUrl HTTP/1.1 "
"67","5.624425900","127.0.0.1","127.0.0.1","TCP","44","56049  >  51398 [ACK] Seq=1 Ack=376 Win=2160896 Len=0"
"68","5.625480500","127.0.0.1","127.0.0.1","HTTP/JSON","339","HTTP/1.1 501 Not Implemented , JSON (application/json)"
"69","5.625507100","127.0.0.1","127.0.0.1","TCP","44","51398  >  56049 [ACK] Seq=376 Ack=296 Win=327168 Len=0"
"70","5.947513400","127.0.0.1","127.0.0.1","TLSv1.2","170","Application Data"
"71","5.947538500","127.0.0.1","127.0.0.1","TCP","44","56051  >  50362 [ACK] Seq=131 Ack=284 Win=8409 Len=0"
"72","5.947698300","127.0.0.1","127.0.0.1","TLSv1.2","75","Application Data"
"73","5.947713500","127.0.0.1","127.0.0.1","TCP","44","56051  >  50362 [ACK] Seq=131 Ack=315 Win=8409 Len=0"
"74","5.947885000","127.0.0.1","127.0.0.1","TLSv1.2","105","Application Data"
"75","5.947901000","127.0.0.1","127.0.0.1","TCP","44","50362  >  56051 [ACK] Seq=315 Ack=192 Win=8243 Len=0"
"76","5.947929900","127.0.0.1","127.0.0.1","TLSv1.2","113","Application Data"
"77","5.947938600","127.0.0.1","127.0.0.1","TCP","44","50362  >  56051 [ACK] Seq=315 Ack=261 Win=8243 Len=0"
"78","6.068017600","127.0.0.1","127.0.0.1","TLSv1.2","125","Application Data"
"79","6.068041900","127.0.0.1","127.0.0.1","TCP","44","56384  >  56401 [ACK] Seq=781 Ack=754 Win=8270 Len=0"
"80","6.068143500","127.0.0.1","127.0.0.1","TLSv1.2","75","Application Data"
"81","6.068158300","127.0.0.1","127.0.0.1","TCP","44","56384  >  56401 [ACK] Seq=781 Ack=785 Win=8270 Len=0"
"82","6.068350100","127.0.0.1","127.0.0.1","TLSv1.2","105","Application Data"
"83","6.068363000","127.0.0.1","127.0.0.1","TCP","44","56401  >  56384 [ACK] Seq=785 Ack=842 Win=8385 Len=0"
"84","6.068384600","127.0.0.1","127.0.0.1","TLSv1.2","113","Application Data"
"85","6.068390700","127.0.0.1","127.0.0.1","TCP","44","56401  >  56384 [ACK] Seq=785 Ack=911 Win=8384 Len=0"
"86","6.218971300","127.0.0.1","127.0.0.1","TCP","45","58181  >  56051 [ACK] Seq=1 Ack=1 Win=1266 Len=1"
"87","6.218991600","127.0.0.1","127.0.0.1","TCP","56","56051  >  58181 [ACK] Seq=1 Ack=2 Win=8430 Len=0 SLE=1 SRE=2"
"88","7.076547900","127.0.0.1","127.0.0.1","TLSv1.2","125","Application Data"
"89","7.076576200","127.0.0.1","127.0.0.1","TCP","44","56384  >  56401 [ACK] Seq=911 Ack=866 Win=8269 Len=0"
"90","7.076685100","127.0.0.1","127.0.0.1","TLSv1.2","75","Application Data"
"91","7.076697500","127.0.0.1","127.0.0.1","TCP","44","56384  >  56401 [ACK] Seq=911 Ack=897 Win=8269 Len=0"
"92","7.077037900","127.0.0.1","127.0.0.1","TLSv1.2","105","Application Data"
"93","7.077054900","127.0.0.1","127.0.0.1","TCP","44","56401  >  56384 [ACK] Seq=897 Ack=972 Win=8384 Len=0"
"94","7.078861900","127.0.0.1","127.0.0.1","TLSv1.2","113","Application Data"
"95","7.078891800","127.0.0.1","127.0.0.1","TCP","44","56401  >  56384 [ACK] Seq=897 Ack=1041 Win=8384 Len=0"
"96","8.076490300","127.0.0.1","127.0.0.1","TLSv1.2","125","Application Data"
"97","8.076513400","127.0.0.1","127.0.0.1","TCP","44","56384  >  56401 [ACK] Seq=1041 Ack=978 Win=8269 Len=0"
"98","8.076630800","127.0.0.1","127.0.0.1","TLSv1.2","75","Application Data"
"99","8.076645200","127.0.0.1","127.0.0.1","TCP","44","56384  >  56401 [ACK] Seq=1041 Ack=1009 Win=8269 Len=0"
"100","8.076836300","127.0.0.1","127.0.0.1","TLSv1.2","105","Application Data"
"101","8.076856400","127.0.0.1","127.0.0.1","TCP","44","56401  >  56384 [ACK] Seq=1009 Ack=1102 Win=8384 Len=0"
"102","8.076885500","127.0.0.1","127.0.0.1","TLSv1.2","113","Application Data"
"103","8.076893200","127.0.0.1","127.0.0.1","TCP","44","56401  >  56384 [ACK] Seq=1009 Ack=1171 Win=8383 Len=0"
"104","9.075960800","127.0.0.1","127.0.0.1","TLSv1.2","125","Application Data"
"105","9.075986700","127.0.0.1","127.0.0.1","TCP","44","56384  >  56401 [ACK] Seq=1171 Ack=1090 Win=8268 Len=0"
"106","9.076093400","127.0.0.1","127.0.0.1","TLSv1.2","75","Application Data"
"107","9.076106200","127.0.0.1","127.0.0.1","TCP","44","56384  >  56401 [ACK] Seq=1171 Ack=1121 Win=8268 Len=0"
"108","9.076256300","127.0.0.1","127.0.0.1","TLSv1.2","105","Application Data"
"109","9.076269400","127.0.0.1","127.0.0.1","TCP","44","56401  >  56384 [ACK] Seq=1121 Ack=1232 Win=8383 Len=0"
"110","9.076305700","127.0.0.1","127.0.0.1","TLSv1.2","113","Application Data"
"111","9.076315600","127.0.0.1","127.0.0.1","TCP","44","56401  >  56384 [ACK] Seq=1121 Ack=1301 Win=8383 Len=0"
"112","10.083766100","127.0.0.1","127.0.0.1","TLSv1.2","125","Application Data"
"113","10.083798900","127.0.0.1","127.0.0.1","TCP","44","56384  >  56401 [ACK] Seq=1301 Ack=1202 Win=8268 Len=0"
"114","10.085114400","127.0.0.1","127.0.0.1","TLSv1.2","75","Application Data"
"115","10.085132800","127.0.0.1","127.0.0.1","TCP","44","56384  >  56401 [ACK] Seq=1301 Ack=1233 Win=8268 Len=0"
"116","10.086624300","127.0.0.1","127.0.0.1","TLSv1.2","105","Application Data"
"117","10.086659300","127.0.0.1","127.0.0.1","TCP","44","56401  >  56384 [ACK] Seq=1233 Ack=1362 Win=8383 Len=0"
"118","10.086708700","127.0.0.1","127.0.0.1","TLSv1.2","113","Application Data"
"119","10.086718700","127.0.0.1","127.0.0.1","TCP","44","56401  >  56384 [ACK] Seq=1233 Ack=1431 Win=8382 Len=0"
"120","10.169431300","127.0.0.1","127.0.0.1","TCP","45","56392  >  56383 [ACK] Seq=1 Ack=1 Win=1277 Len=1"
"121","10.169452000","127.0.0.1","127.0.0.1","TCP","56","56383  >  56392 [ACK] Seq=1 Ack=2 Win=8439 Len=0 SLE=1 SRE=2"
"122","10.185082100","127.0.0.1","127.0.0.1","TCP","45","[TCP Keep-Alive] 56051  >  58181 [ACK] Seq=0 Ack=2 Win=8430 Len=1"
"123","10.185116800","127.0.0.1","127.0.0.1","TCP","56","[TCP Keep-Alive ACK] 58181  >  56051 [ACK] Seq=2 Ack=1 Win=1266 Len=0 SLE=0 SRE=1"
"124","10.185160700","127.0.0.1","127.0.0.1","TCP","45","56388  >  56383 [ACK] Seq=1 Ack=1 Win=1277 Len=1"
"125","10.185176500","127.0.0.1","127.0.0.1","TCP","56","56383  >  56388 [ACK] Seq=1 Ack=2 Win=8440 Len=0 SLE=1 SRE=2"
"126","10.541556500","127.0.0.1","127.0.0.1","TCP","45","56391  >  56394 [ACK] Seq=1 Ack=1 Win=8346 Len=1"
"127","10.541574900","127.0.0.1","127.0.0.1","TCP","56","56394  >  56391 [ACK] Seq=1 Ack=2 Win=1278 Len=0 SLE=1 SRE=2"
"128","10.953627500","127.0.0.1","127.0.0.1","TLSv1.2","170","Application Data"
"129","10.953659500","127.0.0.1","127.0.0.1","TCP","44","56051  >  50362 [ACK] Seq=261 Ack=441 Win=8409 Len=0"
"130","10.954164900","127.0.0.1","127.0.0.1","TLSv1.2","75","Application Data"
"131","10.954182200","127.0.0.1","127.0.0.1","TCP","44","56051  >  50362 [ACK] Seq=261 Ack=472 Win=8408 Len=0"
"132","10.954355600","127.0.0.1","127.0.0.1","TLSv1.2","105","Application Data"
"133","10.954371200","127.0.0.1","127.0.0.1","TCP","44","50362  >  56051 [ACK] Seq=472 Ack=322 Win=8243 Len=0"
"134","10.954396800","127.0.0.1","127.0.0.1","TLSv1.2","113","Application Data"
"135","10.954405500","127.0.0.1","127.0.0.1","TCP","44","50362  >  56051 [ACK] Seq=472 Ack=391 Win=8242 Len=0"
"136","11.104898800","127.0.0.1","127.0.0.1","TLSv1.2","125","Application Data"
"137","11.104932300","127.0.0.1","127.0.0.1","TCP","44","56384  >  56401 [ACK] Seq=1431 Ack=1314 Win=8268 Len=0"
"138","11.105169200","127.0.0.1","127.0.0.1","TLSv1.2","75","Application Data"
"139","11.105181300","127.0.0.1","127.0.0.1","TCP","44","56384  >  56401 [ACK] Seq=1431 Ack=1345 Win=8267 Len=0"
"140","11.106727800","127.0.0.1","127.0.0.1","TLSv1.2","105","Application Data"
"141","11.106757200","127.0.0.1","127.0.0.1","TCP","44","56401  >  56384 [ACK] Seq=1345 Ack=1492 Win=8382 Len=0"
"142","11.106794000","127.0.0.1","127.0.0.1","TLSv1.2","114","Application Data"
"143","11.106802900","127.0.0.1","127.0.0.1","TCP","44","56401  >  56384 [ACK] Seq=1345 Ack=1562 Win=8382 Len=0"
"144","11.107092400","127.0.0.1","127.0.0.1","TCP","56","51400  >  56383 [SYN] Seq=0 Win=65535 Len=0 MSS=65495 WS=256 SACK_PERM"
"145","11.107141900","127.0.0.1","127.0.0.1","TCP","56","56383  >  51400 [SYN, ACK] Seq=0 Ack=1 Win=65535 Len=0 MSS=65495 WS=256 SACK_PERM"
"146","11.107161100","127.0.0.1","127.0.0.1","TCP","44","51400  >  56383 [ACK] Seq=1 Ack=1 Win=327424 Len=0"
"147","11.107291900","127.0.0.1","127.0.0.1","HTTP","419","POST /exa.extension_server_pb.ExtensionServerService/GetChromeDevtoolsMcpUrl HTTP/1.1 "
"148","11.107302900","127.0.0.1","127.0.0.1","TCP","44","56383  >  51400 [ACK] Seq=1 Ack=376 Win=2160896 Len=0"
"149","11.109868700","127.0.0.1","127.0.0.1","HTTP/JSON","264","HTTP/1.1 500 Internal Server Error , JSON (application/json)"
"150","11.109906500","127.0.0.1","127.0.0.1","TCP","44","51400  >  56383 [ACK] Seq=376 Ack=221 Win=327168 Len=0"
"151","11.641070900","127.0.0.1","127.0.0.1","TCP","44","56049  >  51398 [FIN, ACK] Seq=296 Ack=376 Win=2160896 Len=0"
"152","11.641093100","127.0.0.1","127.0.0.1","TCP","44","51398  >  56049 [ACK] Seq=376 Ack=297 Win=327168 Len=0"
"153","11.641123400","127.0.0.1","127.0.0.1","TCP","44","51398  >  56049 [FIN, ACK] Seq=376 Ack=297 Win=327168 Len=0"
"154","11.641139600","127.0.0.1","127.0.0.1","TCP","44","56049  >  51398 [ACK] Seq=297 Ack=377 Win=2160896 Len=0"
"155","12.104322300","127.0.0.1","127.0.0.1","TLSv1.2","125","Application Data"
"156","12.104344900","127.0.0.1","127.0.0.1","TCP","44","56384  >  56401 [ACK] Seq=1562 Ack=1426 Win=8267 Len=0"
"157","12.104452700","127.0.0.1","127.0.0.1","TLSv1.2","75","Application Data"
"158","12.104465000","127.0.0.1","127.0.0.1","TCP","44","56384  >  56401 [ACK] Seq=1562 Ack=1457 Win=8267 Len=0"
"159","12.104609000","127.0.0.1","127.0.0.1","TLSv1.2","105","Application Data"
"160","12.104624600","127.0.0.1","127.0.0.1","TCP","44","56401  >  56384 [ACK] Seq=1457 Ack=1623 Win=8382 Len=0"
"161","12.104801800","127.0.0.1","127.0.0.1","TLSv1.2","114","Application Data"
"162","12.104811200","127.0.0.1","127.0.0.1","TCP","44","56401  >  56384 [ACK] Seq=1457 Ack=1693 Win=8381 Len=0"
"163","12.522459600","127.0.0.1","127.0.0.1","TCP","45","56055  >  56049 [ACK] Seq=1 Ack=1 Win=1277 Len=1"
"164","12.522477900","127.0.0.1","127.0.0.1","TCP","56","56049  >  56055 [ACK] Seq=1 Ack=2 Win=8440 Len=0 SLE=1 SRE=2"
"165","12.927253000","127.0.0.1","127.0.0.1","TCP","56","51402  >  5000 [SYN] Seq=0 Win=65535 Len=0 MSS=65495 WS=256 SACK_PERM"
"166","12.927296200","127.0.0.1","127.0.0.1","TCP","56","5000  >  51402 [SYN, ACK] Seq=0 Ack=1 Win=65535 Len=0 MSS=65495 WS=256 SACK_PERM"
"167","12.927310500","127.0.0.1","127.0.0.1","TCP","44","51402  >  5000 [ACK] Seq=1 Ack=1 Win=2161152 Len=0"
"168","12.927939100","127.0.0.1","127.0.0.1","TCP","103","5000  >  51402 [PSH, ACK] Seq=1 Ack=1 Win=2161152 Len=59"
"169","12.927954100","127.0.0.1","127.0.0.1","TCP","44","51402  >  5000 [ACK] Seq=1 Ack=60 Win=2161152 Len=0"
"170","13.104436200","127.0.0.1","127.0.0.1","TLSv1.2","125","Application Data"
"171","13.104458200","127.0.0.1","127.0.0.1","TCP","44","56384  >  56401 [ACK] Seq=1693 Ack=1538 Win=8267 Len=0"
"172","13.104572400","127.0.0.1","127.0.0.1","TLSv1.2","75","Application Data"
"173","13.104585000","127.0.0.1","127.0.0.1","TCP","44","56384  >  56401 [ACK] Seq=1693 Ack=1569 Win=8267 Len=0"
"174","13.104732000","127.0.0.1","127.0.0.1","TLSv1.2","105","Application Data"
"175","13.104747500","127.0.0.1","127.0.0.1","TCP","44","56401  >  56384 [ACK] Seq=1569 Ack=1754 Win=8381 Len=0"
"176","13.104768900","127.0.0.1","127.0.0.1","TLSv1.2","114","Application Data"
"177","13.104775200","127.0.0.1","127.0.0.1","TCP","44","56401  >  56384 [ACK] Seq=1569 Ack=1824 Win=8381 Len=0"
"178","13.633360500","127.0.0.1","127.0.0.1","TLSv1.2","129","Application Data"
"179","13.633388200","127.0.0.1","127.0.0.1","TCP","44","56051  >  56405 [ACK] Seq=1 Ack=86 Win=8360 Len=0"
"180","13.635331600","127.0.0.1","127.0.0.1","TLSv1.2","75","Application Data"
"181","13.635352500","127.0.0.1","127.0.0.1","TCP","44","56051  >  56405 [ACK] Seq=1 Ack=117 Win=8360 Len=0"
"182","13.642495700","127.0.0.1","127.0.0.1","TLSv1.2","105","Application Data"
"183","13.642530000","127.0.0.1","127.0.0.1","TCP","44","56405  >  56051 [ACK] Seq=117 Ack=62 Win=8279 Len=0"
"184","13.642561700","127.0.0.1","127.0.0.1","TLSv1.2","372","Application Data"
"185","13.642569400","127.0.0.1","127.0.0.1","TCP","44","56405  >  56051 [ACK] Seq=117 Ack=390 Win=8278 Len=0"
"186","14.105338500","127.0.0.1","127.0.0.1","TLSv1.2","125","Application Data"
"187","14.105362000","127.0.0.1","127.0.0.1","TCP","44","56384  >  56401 [ACK] Seq=1824 Ack=1650 Win=8266 Len=0"
"188","14.105470700","127.0.0.1","127.0.0.1","TLSv1.2","75","Application Data"
"189","14.105498100","127.0.0.1","127.0.0.1","TCP","44","56384  >  56401 [ACK] Seq=1824 Ack=1681 Win=8266 Len=0"
"190","14.106870200","127.0.0.1","127.0.0.1","TLSv1.2","105","Application Data"
"191","14.106900900","127.0.0.1","127.0.0.1","TCP","44","56401  >  56384 [ACK] Seq=1681 Ack=1885 Win=8381 Len=0"
"192","14.106942500","127.0.0.1","127.0.0.1","TLSv1.2","114","Application Data"
"193","14.106951800","127.0.0.1","127.0.0.1","TCP","44","56401  >  56384 [ACK] Seq=1681 Ack=1955 Win=8380 Len=0"
"194","15.105063400","127.0.0.1","127.0.0.1","TLSv1.2","125","Application Data"
"195","15.105092500","127.0.0.1","127.0.0.1","TCP","44","56384  >  56401 [ACK] Seq=1955 Ack=1762 Win=8266 Len=0"
"196","15.105279800","127.0.0.1","127.0.0.1","TLSv1.2","75","Application Data"
"197","15.105292700","127.0.0.1","127.0.0.1","TCP","44","56384  >  56401 [ACK] Seq=1955 Ack=1793 Win=8266 Len=0"
"198","15.105488900","127.0.0.1","127.0.0.1","TLSv1.2","105","Application Data"
"199","15.105506400","127.0.0.1","127.0.0.1","TCP","44","56401  >  56384 [ACK] Seq=1793 Ack=2016 Win=8380 Len=0"
"200","15.105539500","127.0.0.1","127.0.0.1","TLSv1.2","114","Application Data"
"201","15.105546900","127.0.0.1","127.0.0.1","TCP","44","56401  >  56384 [ACK] Seq=1793 Ack=2086 Win=8380 Len=0"
"202","15.461447700","127.0.0.1","127.0.0.1","TCP","53","63376  >  49709 [PSH, ACK] Seq=1 Ack=1 Win=8437 Len=9"
"203","15.461469300","127.0.0.1","127.0.0.1","TCP","44","49709  >  63376 [ACK] Seq=1 Ack=10 Win=8432 Len=0"
"204","15.461999000","127.0.0.1","127.0.0.1","TCP","47","49709  >  63376 [PSH, ACK] Seq=1 Ack=10 Win=8432 Len=3"
"205","15.462014800","127.0.0.1","127.0.0.1","TCP","44","63376  >  49709 [ACK] Seq=10 Ack=4 Win=8437 Len=0"
"206","15.966393400","127.0.0.1","127.0.0.1","TLSv1.2","170","Application Data"
"207","15.966419800","127.0.0.1","127.0.0.1","TCP","44","56051  >  50362 [ACK] Seq=391 Ack=598 Win=8408 Len=0"
"208","15.967641200","127.0.0.1","127.0.0.1","TLSv1.2","75","Application Data"
"209","15.967665600","127.0.0.1","127.0.0.1","TCP","44","56051  >  50362 [ACK] Seq=391 Ack=629 Win=8408 Len=0"
"210","15.967882100","127.0.0.1","127.0.0.1","TLSv1.2","105","Application Data"
"211","15.967896400","127.0.0.1","127.0.0.1","TCP","44","50362  >  56051 [ACK] Seq=629 Ack=452 Win=8242 Len=0"
"212","15.967962300","127.0.0.1","127.0.0.1","TLSv1.2","113","Application Data"
"213","15.967970800","127.0.0.1","127.0.0.1","TCP","44","50362  >  56051 [ACK] Seq=629 Ack=521 Win=8242 Len=0"
"214","16.104765200","127.0.0.1","127.0.0.1","TLSv1.2","125","Application Data"
"215","16.104789500","127.0.0.1","127.0.0.1","TCP","44","56384  >  56401 [ACK] Seq=2086 Ack=1874 Win=8265 Len=0"
"216","16.104894500","127.0.0.1","127.0.0.1","TLSv1.2","75","Application Data"
"217","16.104906700","127.0.0.1","127.0.0.1","TCP","44","56384  >  56401 [ACK] Seq=2086 Ack=1905 Win=8265 Len=0"
"218","16.105085700","127.0.0.1","127.0.0.1","TLSv1.2","105","Application Data"
"219","16.105100800","127.0.0.1","127.0.0.1","TCP","44","56401  >  56384 [ACK] Seq=1905 Ack=2147 Win=8379 Len=0"
"220","16.105128300","127.0.0.1","127.0.0.1","TLSv1.2","114","Application Data"
"221","16.105137300","127.0.0.1","127.0.0.1","TCP","44","56401  >  56384 [ACK] Seq=1905 Ack=2217 Win=8379 Len=0"
"222","17.104966500","127.0.0.1","127.0.0.1","TLSv1.2","125","Application Data"
"223","17.104988600","127.0.0.1","127.0.0.1","TCP","44","56384  >  56401 [ACK] Seq=2217 Ack=1986 Win=8265 Len=0"
"224","17.105091000","127.0.0.1","127.0.0.1","TLSv1.2","75","Application Data"
"225","17.105103200","127.0.0.1","127.0.0.1","TCP","44","56384  >  56401 [ACK] Seq=2217 Ack=2017 Win=8265 Len=0"
"226","17.105276100","127.0.0.1","127.0.0.1","TLSv1.2","105","Application Data"
"227","17.105295100","127.0.0.1","127.0.0.1","TCP","44","56401  >  56384 [ACK] Seq=2017 Ack=2278 Win=8379 Len=0"
"228","17.105319000","127.0.0.1","127.0.0.1","TLSv1.2","114","Application Data"
"229","17.105325600","127.0.0.1","127.0.0.1","TCP","44","56401  >  56384 [ACK] Seq=2017 Ack=2348 Win=8379 Len=0"
"230","17.110655100","127.0.0.1","127.0.0.1","TCP","44","56383  >  51400 [FIN, ACK] Seq=221 Ack=376 Win=2160896 Len=0"
"231","17.110679400","127.0.0.1","127.0.0.1","TCP","44","51400  >  56383 [ACK] Seq=376 Ack=222 Win=327168 Len=0"
"232","17.110726600","127.0.0.1","127.0.0.1","TCP","44","51400  >  56383 [FIN, ACK] Seq=376 Ack=222 Win=327168 Len=0"
"233","17.110747400","127.0.0.1","127.0.0.1","TCP","44","56383  >  51400 [ACK] Seq=222 Ack=377 Win=2160896 Len=0"
"234","18.105317600","127.0.0.1","127.0.0.1","TLSv1.2","125","Application Data"
"235","18.105340200","127.0.0.1","127.0.0.1","TCP","44","56384  >  56401 [ACK] Seq=2348 Ack=2098 Win=8264 Len=0"
"236","18.105436700","127.0.0.1","127.0.0.1","TLSv1.2","75","Application Data"
"237","18.105452300","127.0.0.1","127.0.0.1","TCP","44","56384  >  56401 [ACK] Seq=2348 Ack=2129 Win=8264 Len=0"
"238","18.105587900","127.0.0.1","127.0.0.1","TLSv1.2","105","Application Data"
"239","18.105603100","127.0.0.1","127.0.0.1","TCP","44","56401  >  56384 [ACK] Seq=2129 Ack=2409 Win=8378 Len=0"
"240","18.105627200","127.0.0.1","127.0.0.1","TLSv1.2","114","Application Data"
"241","18.105636100","127.0.0.1","127.0.0.1","TCP","44","56401  >  56384 [ACK] Seq=2129 Ack=2479 Win=8378 Len=0"
"242","19.130737500","127.0.0.1","127.0.0.1","TLSv1.2","125","Application Data"
"243","19.130772500","127.0.0.1","127.0.0.1","TCP","44","56384  >  56401 [ACK] Seq=2479 Ack=2210 Win=8264 Len=0"
"244","19.130888600","127.0.0.1","127.0.0.1","TLSv1.2","75","Application Data"
"245","19.130901400","127.0.0.1","127.0.0.1","TCP","44","56384  >  56401 [ACK] Seq=2479 Ack=2241 Win=8264 Len=0"
"246","19.131157400","127.0.0.1","127.0.0.1","TLSv1.2","105","Application Data"
"247","19.131176100","127.0.0.1","127.0.0.1","TCP","44","56401  >  56384 [ACK] Seq=2241 Ack=2540 Win=8378 Len=0"
"248","19.131252800","127.0.0.1","127.0.0.1","TLSv1.2","114","Application Data"
"249","19.131270200","127.0.0.1","127.0.0.1","TCP","44","56401  >  56384 [ACK] Seq=2241 Ack=2610 Win=8378 Len=0"
"250","19.849580700","::1","::1","TCP","82","3000  >  57170 [PSH, ACK] Seq=1 Ack=1 Win=8427 Len=18"
"251","19.849601100","::1","::1","TCP","64","57170  >  3000 [ACK] Seq=1 Ack=19 Win=8299 Len=0"
"252","20.104718300","127.0.0.1","127.0.0.1","TCP","45","52056  >  56049 [ACK] Seq=1 Ack=1 Win=8441 Len=1"
"253","20.104739100","127.0.0.1","127.0.0.1","TCP","56","56049  >  52056 [ACK] Seq=1 Ack=2 Win=8440 Len=0 SLE=1 SRE=2"
"254","20.130574800","127.0.0.1","127.0.0.1","TLSv1.2","125","Application Data"
"255","20.130597200","127.0.0.1","127.0.0.1","TCP","44","56384  >  56401 [ACK] Seq=2610 Ack=2322 Win=8264 Len=0"
"256","20.130728800","127.0.0.1","127.0.0.1","TLSv1.2","75","Application Data"
"257","20.130746800","127.0.0.1","127.0.0.1","TCP","44","56384  >  56401 [ACK] Seq=2610 Ack=2353 Win=8263 Len=0"
"258","20.130953400","127.0.0.1","127.0.0.1","TLSv1.2","105","Application Data"
"259","20.130974300","127.0.0.1","127.0.0.1","TCP","44","56401  >  56384 [ACK] Seq=2353 Ack=2671 Win=8377 Len=0"
"260","20.131010900","127.0.0.1","127.0.0.1","TLSv1.2","114","Application Data"
"261","20.131020100","127.0.0.1","127.0.0.1","TCP","44","56401  >  56384 [ACK] Seq=2353 Ack=2741 Win=8377 Len=0"
"262","20.973258500","127.0.0.1","127.0.0.1","TLSv1.2","170","Application Data"
"263","20.973279200","127.0.0.1","127.0.0.1","TCP","44","56051  >  50362 [ACK] Seq=521 Ack=755 Win=8407 Len=0"
"264","20.973398900","127.0.0.1","127.0.0.1","TLSv1.2","75","Application Data"
"265","20.973410900","127.0.0.1","127.0.0.1","TCP","44","56051  >  50362 [ACK] Seq=521 Ack=786 Win=8407 Len=0"
"266","20.973605300","127.0.0.1","127.0.0.1","TLSv1.2","105","Application Data"
"267","20.973620300","127.0.0.1","127.0.0.1","TCP","44","50362  >  56051 [ACK] Seq=786 Ack=582 Win=8242 Len=0"
"268","20.973641600","127.0.0.1","127.0.0.1","TLSv1.2","113","Application Data"
"269","20.973648400","127.0.0.1","127.0.0.1","TCP","44","50362  >  56051 [ACK] Seq=786 Ack=651 Win=8241 Len=0"
"270","21.131587000","127.0.0.1","127.0.0.1","TLSv1.2","125","Application Data"
"271","21.131609100","127.0.0.1","127.0.0.1","TCP","44","56384  >  56401 [ACK] Seq=2741 Ack=2434 Win=8263 Len=0"
"272","21.131712000","127.0.0.1","127.0.0.1","TLSv1.2","75","Application Data"
"273","21.131724600","127.0.0.1","127.0.0.1","TCP","44","56384  >  56401 [ACK] Seq=2741 Ack=2465 Win=8263 Len=0"
"274","21.131947700","127.0.0.1","127.0.0.1","TLSv1.2","105","Application Data"
"275","21.131982300","127.0.0.1","127.0.0.1","TCP","44","56401  >  56384 [ACK] Seq=2465 Ack=2802 Win=8377 Len=0"
"276","21.132030400","127.0.0.1","127.0.0.1","TLSv1.2","114","Application Data"
"277","21.132039600","127.0.0.1","127.0.0.1","TCP","44","56401  >  56384 [ACK] Seq=2465 Ack=2872 Win=8377 Len=0"
"278","22.135111900","127.0.0.1","127.0.0.1","TLSv1.2","125","Application Data"
"279","22.135146600","127.0.0.1","127.0.0.1","TCP","44","56384  >  56401 [ACK] Seq=2872 Ack=2546 Win=8263 Len=0"
"280","22.135262800","127.0.0.1","127.0.0.1","TLSv1.2","75","Application Data"
"281","22.135278900","127.0.0.1","127.0.0.1","TCP","44","56384  >  56401 [ACK] Seq=2872 Ack=2577 Win=8263 Len=0"
"282","22.135489200","127.0.0.1","127.0.0.1","TLSv1.2","105","Application Data"
"283","22.135511900","127.0.0.1","127.0.0.1","TCP","44","56401  >  56384 [ACK] Seq=2577 Ack=2933 Win=8376 Len=0"
"284","22.135554800","127.0.0.1","127.0.0.1","TLSv1.2","114","Application Data"
"285","22.135566600","127.0.0.1","127.0.0.1","TCP","44","56401  >  56384 [ACK] Seq=2577 Ack=3003 Win=8376 Len=0"
"286","23.134978400","127.0.0.1","127.0.0.1","TLSv1.2","125","Application Data"
"287","23.135013000","127.0.0.1","127.0.0.1","TCP","44","56384  >  56401 [ACK] Seq=3003 Ack=2658 Win=8262 Len=0"
"288","23.135153100","127.0.0.1","127.0.0.1","TLSv1.2","75","Application Data"
"289","23.135170100","127.0.0.1","127.0.0.1","TCP","44","56384  >  56401 [ACK] Seq=3003 Ack=2689 Win=8262 Len=0"
"290","23.135335000","127.0.0.1","127.0.0.1","TLSv1.2","105","Application Data"
"291","23.135351900","127.0.0.1","127.0.0.1","TCP","44","56401  >  56384 [ACK] Seq=2689 Ack=3064 Win=8376 Len=0"
"292","23.135381500","127.0.0.1","127.0.0.1","TLSv1.2","114","Application Data"
"293","23.135389900","127.0.0.1","127.0.0.1","TCP","44","56401  >  56384 [ACK] Seq=2689 Ack=3134 Win=8376 Len=0"
"294","23.966366100","127.0.0.1","127.0.0.1","TCP","56","51405  >  5000 [SYN] Seq=0 Win=65535 Len=0 MSS=65495 WS=256 SACK_PERM"
"295","23.966424900","127.0.0.1","127.0.0.1","TCP","56","5000  >  51405 [SYN, ACK] Seq=0 Ack=1 Win=65535 Len=0 MSS=65495 WS=256 SACK_PERM"
"296","23.966447900","127.0.0.1","127.0.0.1","TCP","44","51405  >  5000 [ACK] Seq=1 Ack=1 Win=2161152 Len=0"
"297","23.966964500","127.0.0.1","127.0.0.1","TCP","103","5000  >  51405 [PSH, ACK] Seq=1 Ack=1 Win=2161152 Len=59"
"298","23.966997400","127.0.0.1","127.0.0.1","TCP","44","51405  >  5000 [ACK] Seq=1 Ack=60 Win=2161152 Len=0"
"299","24.135828200","127.0.0.1","127.0.0.1","TLSv1.2","125","Application Data"
"300","24.135853100","127.0.0.1","127.0.0.1","TCP","44","56384  >  56401 [ACK] Seq=3134 Ack=2770 Win=8262 Len=0"
"301","24.135988700","127.0.0.1","127.0.0.1","TLSv1.2","75","Application Data"
"302","24.136003200","127.0.0.1","127.0.0.1","TCP","44","56384  >  56401 [ACK] Seq=3134 Ack=2801 Win=8262 Len=0"
"303","24.136161600","127.0.0.1","127.0.0.1","TLSv1.2","105","Application Data"
"304","24.136180200","127.0.0.1","127.0.0.1","TCP","44","56401  >  56384 [ACK] Seq=2801 Ack=3195 Win=8375 Len=0"
"305","24.136210400","127.0.0.1","127.0.0.1","TLSv1.2","114","Application Data"
"306","24.136217900","127.0.0.1","127.0.0.1","TCP","44","56401  >  56384 [ACK] Seq=2801 Ack=3265 Win=8375 Len=0"
"307","25.136815400","127.0.0.1","127.0.0.1","TLSv1.2","125","Application Data"
"308","25.136846900","127.0.0.1","127.0.0.1","TCP","44","56384  >  56401 [ACK] Seq=3265 Ack=2882 Win=8261 Len=0"
"309","25.136981400","127.0.0.1","127.0.0.1","TLSv1.2","75","Application Data"
"310","25.136999300","127.0.0.1","127.0.0.1","TCP","44","56384  >  56401 [ACK] Seq=3265 Ack=2913 Win=8261 Len=0"
"311","25.137190300","127.0.0.1","127.0.0.1","TLSv1.2","105","Application Data"
"312","25.137211500","127.0.0.1","127.0.0.1","TCP","44","56401  >  56384 [ACK] Seq=2913 Ack=3326 Win=8375 Len=0"
"313","25.137244100","127.0.0.1","127.0.0.1","TLSv1.2","114","Application Data"
"314","25.137252500","127.0.0.1","127.0.0.1","TCP","44","56401  >  56384 [ACK] Seq=2913 Ack=3396 Win=8375 Len=0"
"315","25.196532500","127.0.0.1","127.0.0.1","TCP","45","[TCP Keep-Alive] 56051  >  58181 [ACK] Seq=0 Ack=2 Win=8430 Len=1"
"316","25.196553100","127.0.0.1","127.0.0.1","TCP","56","[TCP Keep-Alive ACK] 58181  >  56051 [ACK] Seq=2 Ack=1 Win=1266 Len=0 SLE=0 SRE=1"
"317","25.477114500","127.0.0.1","127.0.0.1","TCP","108","51405  >  5000 [PSH, ACK] Seq=1 Ack=60 Win=2161152 Len=64"
"318","25.477147800","127.0.0.1","127.0.0.1","TCP","44","5000  >  51405 [ACK] Seq=60 Ack=65 Win=2161152 Len=0"
"319","25.500849800","127.0.0.1","127.0.0.1","TCP","108","5000  >  51402 [PSH, ACK] Seq=60 Ack=1 Win=2161152 Len=64"
"320","25.500890900","127.0.0.1","127.0.0.1","TCP","44","51402  >  5000 [ACK] Seq=1 Ack=124 Win=2161152 Len=0"
"321","25.555223200","127.0.0.1","127.0.0.1","TCP","45","[TCP Keep-Alive] 56391  >  56394 [ACK] Seq=1 Ack=1 Win=8346 Len=1"
"322","25.555246500","127.0.0.1","127.0.0.1","TCP","56","[TCP Keep-Alive ACK] 56394  >  56391 [ACK] Seq=1 Ack=2 Win=1278 Len=0 SLE=1 SRE=2"
"323","25.983087600","127.0.0.1","127.0.0.1","TLSv1.2","170","Application Data"
"324","25.983114500","127.0.0.1","127.0.0.1","TCP","44","56051  >  50362 [ACK] Seq=651 Ack=912 Win=8407 Len=0"
"325","25.983555700","127.0.0.1","127.0.0.1","TLSv1.2","75","Application Data"
"326","25.983574200","127.0.0.1","127.0.0.1","TCP","44","56051  >  50362 [ACK] Seq=651 Ack=943 Win=8407 Len=0"
"327","25.983730500","127.0.0.1","127.0.0.1","TLSv1.2","105","Application Data"
"328","25.983747100","127.0.0.1","127.0.0.1","TCP","44","50362  >  56051 [ACK] Seq=943 Ack=712 Win=8241 Len=0"
"329","25.983773300","127.0.0.1","127.0.0.1","TLSv1.2","113","Application Data"
"330","25.983782100","127.0.0.1","127.0.0.1","TCP","44","50362  >  56051 [ACK] Seq=943 Ack=781 Win=8241 Len=0"
"331","26.135981400","127.0.0.1","127.0.0.1","TLSv1.2","125","Application Data"
"332","26.136013400","127.0.0.1","127.0.0.1","TCP","44","56384  >  56401 [ACK] Seq=3396 Ack=2994 Win=8261 Len=0"
"333","26.136151600","127.0.0.1","127.0.0.1","TLSv1.2","75","Application Data"
"334","26.136169400","127.0.0.1","127.0.0.1","TCP","44","56384  >  56401 [ACK] Seq=3396 Ack=3025 Win=8261 Len=0"
"335","26.136346100","127.0.0.1","127.0.0.1","TLSv1.2","105","Application Data"
"336","26.136366700","127.0.0.1","127.0.0.1","TCP","44","56401  >  56384 [ACK] Seq=3025 Ack=3457 Win=8374 Len=0"
"337","26.136394300","127.0.0.1","127.0.0.1","TLSv1.2","114","Application Data"
"338","26.136401700","127.0.0.1","127.0.0.1","TCP","44","56401  >  56384 [ACK] Seq=3025 Ack=3527 Win=8374 Len=0"
"339","27.135928800","127.0.0.1","127.0.0.1","TLSv1.2","125","Application Data"
"340","27.135950300","127.0.0.1","127.0.0.1","TCP","44","56384  >  56401 [ACK] Seq=3527 Ack=3106 Win=8261 Len=0"
"341","27.136145900","127.0.0.1","127.0.0.1","TLSv1.2","75","Application Data"
"342","27.136159800","127.0.0.1","127.0.0.1","TCP","44","56384  >  56401 [ACK] Seq=3527 Ack=3137 Win=8260 Len=0"
"343","27.136324100","127.0.0.1","127.0.0.1","TLSv1.2","105","Application Data"
"344","27.136342800","127.0.0.1","127.0.0.1","TCP","44","56401  >  56384 [ACK] Seq=3137 Ack=3588 Win=8374 Len=0"
"345","27.136373000","127.0.0.1","127.0.0.1","TLSv1.2","114","Application Data"
"346","27.136381000","127.0.0.1","127.0.0.1","TCP","44","56401  >  56384 [ACK] Seq=3137 Ack=3658 Win=8374 Len=0"
"347","28.136989100","127.0.0.1","127.0.0.1","TLSv1.2","125","Application Data"
"348","28.137011400","127.0.0.1","127.0.0.1","TCP","44","56384  >  56401 [ACK] Seq=3658 Ack=3218 Win=8260 Len=0"
"349","28.137112300","127.0.0.1","127.0.0.1","TLSv1.2","75","Application Data"
"350","28.137124500","127.0.0.1","127.0.0.1","TCP","44","56384  >  56401 [ACK] Seq=3658 Ack=3249 Win=8260 Len=0"
"351","28.137267500","127.0.0.1","127.0.0.1","TLSv1.2","108","Application Data"
"352","28.137283700","127.0.0.1","127.0.0.1","TCP","44","56401  >  56384 [ACK] Seq=3249 Ack=3722 Win=8373 Len=0"
"353","28.137305600","127.0.0.1","127.0.0.1","TLSv1.2","114","Application Data"
"354","28.137311500","127.0.0.1","127.0.0.1","TCP","44","56401  >  56384 [ACK] Seq=3249 Ack=3792 Win=8373 Len=0"
"355","28.659236300","127.0.0.1","127.0.0.1","TCP","45","[TCP Keep-Alive] 56051  >  56405 [ACK] Seq=389 Ack=117 Win=8360 Len=1"
"356","28.659255800","127.0.0.1","127.0.0.1","TCP","56","[TCP Keep-Alive ACK] 56405  >  56051 [ACK] Seq=117 Ack=390 Win=8278 Len=0 SLE=389 SRE=390"
"357","29.136762700","127.0.0.1","127.0.0.1","TLSv1.2","125","Application Data"
"358","29.136787300","127.0.0.1","127.0.0.1","TCP","44","56384  >  56401 [ACK] Seq=3792 Ack=3330 Win=8260 Len=0"
"359","29.136895900","127.0.0.1","127.0.0.1","TLSv1.2","75","Application Data"
"360","29.136910200","127.0.0.1","127.0.0.1","TCP","44","56384  >  56401 [ACK] Seq=3792 Ack=3361 Win=8260 Len=0"
"361","29.137099000","127.0.0.1","127.0.0.1","TLSv1.2","105","Application Data"
"362","29.137119300","127.0.0.1","127.0.0.1","TCP","44","56401  >  56384 [ACK] Seq=3361 Ack=3853 Win=8373 Len=0"
"363","29.137150200","127.0.0.1","127.0.0.1","TLSv1.2","114","Application Data"
"364","29.137158600","127.0.0.1","127.0.0.1","TCP","44","56401  >  56384 [ACK] Seq=3361 Ack=3923 Win=8373 Len=0"
"365","30.145874200","127.0.0.1","127.0.0.1","TLSv1.2","125","Application Data"
"366","30.145899700","127.0.0.1","127.0.0.1","TCP","44","56384  >  56401 [ACK] Seq=3923 Ack=3442 Win=8259 Len=0"
"367","30.155520200","127.0.0.1","127.0.0.1","TLSv1.2","75","Application Data"
"368","30.155548300","127.0.0.1","127.0.0.1","TCP","44","56384  >  56401 [ACK] Seq=3923 Ack=3473 Win=8259 Len=0"
"369","30.157864800","127.0.0.1","127.0.0.1","TLSv1.2","105","Application Data"
"370","30.157898500","127.0.0.1","127.0.0.1","TCP","44","56401  >  56384 [ACK] Seq=3473 Ack=3984 Win=8372 Len=0"
"371","30.158416800","127.0.0.1","127.0.0.1","TLSv1.2","114","Application Data"
"372","30.158436700","127.0.0.1","127.0.0.1","TCP","44","56401  >  56384 [ACK] Seq=3473 Ack=4054 Win=8372 Len=0"
"373","30.191702800","127.0.0.1","127.0.0.1","TCP","44","51402  >  5000 [RST, ACK] Seq=1 Ack=124 Win=0 Len=0"
"374","30.990939300","127.0.0.1","127.0.0.1","TLSv1.2","170","Application Data"
"375","30.990968900","127.0.0.1","127.0.0.1","TCP","44","56051  >  50362 [ACK] Seq=781 Ack=1069 Win=8406 Len=0"
"376","30.991121600","127.0.0.1","127.0.0.1","TLSv1.2","75","Application Data"
"377","30.991133400","127.0.0.1","127.0.0.1","TCP","44","56051  >  50362 [ACK] Seq=781 Ack=1100 Win=8406 Len=0"
"378","31.003814100","127.0.0.1","127.0.0.1","TLSv1.2","105","Application Data"
"379","31.003848100","127.0.0.1","127.0.0.1","TCP","44","50362  >  56051 [ACK] Seq=1100 Ack=842 Win=8241 Len=0"
"380","31.003877900","127.0.0.1","127.0.0.1","TLSv1.2","113","Application Data"
"381","31.003885200","127.0.0.1","127.0.0.1","TCP","44","50362  >  56051 [ACK] Seq=1100 Ack=911 Win=8240 Len=0"
"382","31.140634100","127.0.0.1","127.0.0.1","TLSv1.2","125","Application Data"
"383","31.140658800","127.0.0.1","127.0.0.1","TCP","44","56384  >  56401 [ACK] Seq=4054 Ack=3554 Win=8259 Len=0"
"384","31.140793300","127.0.0.1","127.0.0.1","TLSv1.2","75","Application Data"
"385","31.140807200","127.0.0.1","127.0.0.1","TCP","44","56384  >  56401 [ACK] Seq=4054 Ack=3585 Win=8259 Len=0"
"386","31.140957700","127.0.0.1","127.0.0.1","TLSv1.2","105","Application Data"
"387","31.140977300","127.0.0.1","127.0.0.1","TCP","44","56401  >  56384 [ACK] Seq=3585 Ack=4115 Win=8372 Len=0"
"388","31.141004900","127.0.0.1","127.0.0.1","TLSv1.2","114","Application Data"
"389","31.141013600","127.0.0.1","127.0.0.1","TCP","44","56401  >  56384 [ACK] Seq=3585 Ack=4185 Win=8372 Len=0"
"390","31.757487100","127.0.0.1","127.0.0.1","TCP","45","[TCP Keep-Alive] 56059  >  56049 [ACK] Seq=1 Ack=1 Win=1269 Len=1"
"391","31.757502100","127.0.0.1","127.0.0.1","TCP","56","[TCP Keep-Alive ACK] 56049  >  56059 [ACK] Seq=1 Ack=2 Win=8440 Len=0 SLE=1 SRE=2"
"392","31.757508900","127.0.0.1","127.0.0.1","TCP","45","[TCP Keep-Alive] 56393  >  56383 [ACK] Seq=1 Ack=1 Win=1263 Len=1"
"393","31.757513100","127.0.0.1","127.0.0.1","TCP","56","[TCP Keep-Alive ACK] 56383  >  56393 [ACK] Seq=1 Ack=2 Win=8440 Len=0 SLE=1 SRE=2"
"394","32.141386500","127.0.0.1","127.0.0.1","TLSv1.2","125","Application Data"
"395","32.141408600","127.0.0.1","127.0.0.1","TCP","44","56384  >  56401 [ACK] Seq=4185 Ack=3666 Win=8258 Len=0"
"396","32.141511300","127.0.0.1","127.0.0.1","TLSv1.2","75","Application Data"
"397","32.141524600","127.0.0.1","127.0.0.1","TCP","44","56384  >  56401 [ACK] Seq=4185 Ack=3697 Win=8258 Len=0"
"398","32.141680300","127.0.0.1","127.0.0.1","TLSv1.2","132","Application Data"
"399","32.141696000","127.0.0.1","127.0.0.1","TCP","44","56401  >  56384 [ACK] Seq=3697 Ack=4273 Win=8371 Len=0"
"400","32.141721900","127.0.0.1","127.0.0.1","TLSv1.2","114","Application Data"
"401","32.141730900","127.0.0.1","127.0.0.1","TCP","44","56401  >  56384 [ACK] Seq=3697 Ack=4343 Win=8371 Len=0"
"402","32.770775300","127.0.0.1","127.0.0.1","TCP","56","51408  >  5000 [SYN] Seq=0 Win=65535 Len=0 MSS=65495 WS=256 SACK_PERM"
"403","32.770831000","127.0.0.1","127.0.0.1","TCP","56","5000  >  51408 [SYN, ACK] Seq=0 Ack=1 Win=65535 Len=0 MSS=65495 WS=256 SACK_PERM"
"404","32.770852200","127.0.0.1","127.0.0.1","TCP","44","51408  >  5000 [ACK] Seq=1 Ack=1 Win=2161152 Len=0"
"405","32.793381500","127.0.0.1","127.0.0.1","TCP","103","5000  >  51408 [PSH, ACK] Seq=1 Ack=1 Win=2161152 Len=59"
"406","32.793415400","127.0.0.1","127.0.0.1","TCP","44","51408  >  5000 [ACK] Seq=1 Ack=60 Win=2161152 Len=0"
"407","33.141692300","127.0.0.1","127.0.0.1","TLSv1.2","125","Application Data"
"408","33.141715500","127.0.0.1","127.0.0.1","TCP","44","56384  >  56401 [ACK] Seq=4343 Ack=3778 Win=8258 Len=0"
"409","33.141839700","127.0.0.1","127.0.0.1","TLSv1.2","75","Application Data"
"410","33.141854600","127.0.0.1","127.0.0.1","TCP","44","56384  >  56401 [ACK] Seq=4343 Ack=3809 Win=8258 Len=0"
"411","33.142053800","127.0.0.1","127.0.0.1","TLSv1.2","105","Application Data"
"412","33.142071700","127.0.0.1","127.0.0.1","TCP","44","56401  >  56384 [ACK] Seq=3809 Ack=4404 Win=8371 Len=0"
"413","33.142098800","127.0.0.1","127.0.0.1","TLSv1.2","114","Application Data"
"414","33.142106900","127.0.0.1","127.0.0.1","TCP","44","56401  >  56384 [ACK] Seq=3809 Ack=4474 Win=8370 Len=0"
"415","33.367267700","127.0.0.1","127.0.0.1","TCP","104","51408  >  5000 [PSH, ACK] Seq=1 Ack=60 Win=2161152 Len=60"
"416","33.367291900","127.0.0.1","127.0.0.1","TCP","44","5000  >  51408 [ACK] Seq=60 Ack=61 Win=2161152 Len=0"
"417","33.367492200","127.0.0.1","127.0.0.1","TCP","104","5000  >  51405 [PSH, ACK] Seq=60 Ack=65 Win=2161152 Len=60"
"418","33.367508900","127.0.0.1","127.0.0.1","TCP","44","51405  >  5000 [ACK] Seq=65 Ack=120 Win=2161152 Len=0"
"419","33.493737000","127.0.0.1","127.0.0.1","TCP","100","51408  >  5000 [PSH, ACK] Seq=61 Ack=60 Win=2161152 Len=56"
"420","33.493766700","127.0.0.1","127.0.0.1","TCP","44","5000  >  51408 [ACK] Seq=60 Ack=117 Win=2161152 Len=0"
"421","33.493986200","127.0.0.1","127.0.0.1","TCP","100","5000  >  51405 [PSH, ACK] Seq=120 Ack=65 Win=2161152 Len=56"
"422","33.494005600","127.0.0.1","127.0.0.1","TCP","44","51405  >  5000 [ACK] Seq=65 Ack=176 Win=2161152 Len=0"
"423","33.621515200","127.0.0.1","127.0.0.1","TCP","100","51408  >  5000 [PSH, ACK] Seq=117 Ack=60 Win=2161152 Len=56"
"424","33.621542800","127.0.0.1","127.0.0.1","TCP","44","5000  >  51408 [ACK] Seq=60 Ack=173 Win=2161152 Len=0"
"425","33.621749800","127.0.0.1","127.0.0.1","TCP","100","5000  >  51405 [PSH, ACK] Seq=176 Ack=65 Win=2161152 Len=56"
"426","33.621768700","127.0.0.1","127.0.0.1","TCP","44","51405  >  5000 [ACK] Seq=65 Ack=232 Win=2160896 Len=0"
"427","33.668851900","127.0.0.1","127.0.0.1","TCP","45","[TCP Keep-Alive] 55548  >  56049 [ACK] Seq=1 Ack=1 Win=1278 Len=1"
"428","33.668873800","127.0.0.1","127.0.0.1","TCP","56","[TCP Keep-Alive ACK] 56049  >  55548 [ACK] Seq=1 Ack=2 Win=8440 Len=0 SLE=1 SRE=2"
"429","33.733465500","127.0.0.1","127.0.0.1","TCP","100","51408  >  5000 [PSH, ACK] Seq=173 Ack=60 Win=2161152 Len=56"
"430","33.733489500","127.0.0.1","127.0.0.1","TCP","44","5000  >  51408 [ACK] Seq=60 Ack=229 Win=2160896 Len=0"
"431","33.733726600","127.0.0.1","127.0.0.1","TCP","100","5000  >  51405 [PSH, ACK] Seq=232 Ack=65 Win=2161152 Len=56"
"432","33.733741500","127.0.0.1","127.0.0.1","TCP","44","51405  >  5000 [ACK] Seq=65 Ack=288 Win=2160896 Len=0"
"433","33.909724500","127.0.0.1","127.0.0.1","TCP","100","51408  >  5000 [PSH, ACK] Seq=229 Ack=60 Win=2161152 Len=56"
"434","33.909754500","127.0.0.1","127.0.0.1","TCP","44","5000  >  51408 [ACK] Seq=60 Ack=285 Win=2160896 Len=0"
"435","33.910063900","127.0.0.1","127.0.0.1","TCP","100","5000  >  51405 [PSH, ACK] Seq=288 Ack=65 Win=2161152 Len=56"
"436","33.910086700","127.0.0.1","127.0.0.1","TCP","44","51405  >  5000 [ACK] Seq=65 Ack=344 Win=2160896 Len=0"
"437","34.072910200","127.0.0.1","127.0.0.1","TCP","100","51408  >  5000 [PSH, ACK] Seq=285 Ack=60 Win=2161152 Len=56"
"438","34.072946300","127.0.0.1","127.0.0.1","TCP","44","5000  >  51408 [ACK] Seq=60 Ack=341 Win=2160896 Len=0"
"439","34.103467300","127.0.0.1","127.0.0.1","TCP","100","5000  >  51405 [PSH, ACK] Seq=344 Ack=65 Win=2161152 Len=56"
"440","34.103502700","127.0.0.1","127.0.0.1","TCP","44","51405  >  5000 [ACK] Seq=65 Ack=400 Win=2160896 Len=0"
"441","34.141787400","127.0.0.1","127.0.0.1","TLSv1.2","125","Application Data"
"442","34.141820900","127.0.0.1","127.0.0.1","TCP","44","56384  >  56401 [ACK] Seq=4474 Ack=3890 Win=8257 Len=0"
"443","34.142109900","127.0.0.1","127.0.0.1","TLSv1.2","75","Application Data"
"444","34.142129300","127.0.0.1","127.0.0.1","TCP","44","56384  >  56401 [ACK] Seq=4474 Ack=3921 Win=8257 Len=0"
"445","34.142299600","127.0.0.1","127.0.0.1","TLSv1.2","105","Application Data"
"446","34.142315100","127.0.0.1","127.0.0.1","TCP","44","56401  >  56384 [ACK] Seq=3921 Ack=4535 Win=8370 Len=0"
"447","34.142342300","127.0.0.1","127.0.0.1","TLSv1.2","114","Application Data"
"448","34.142351100","127.0.0.1","127.0.0.1","TCP","44","56401  >  56384 [ACK] Seq=3921 Ack=4605 Win=8370 Len=0"
"449","34.197397600","127.0.0.1","127.0.0.1","TCP","100","51408  >  5000 [PSH, ACK] Seq=341 Ack=60 Win=2161152 Len=56"
"450","34.197422800","127.0.0.1","127.0.0.1","TCP","44","5000  >  51408 [ACK] Seq=60 Ack=397 Win=2160896 Len=0"
"451","34.197601800","127.0.0.1","127.0.0.1","TCP","100","5000  >  51405 [PSH, ACK] Seq=400 Ack=65 Win=2161152 Len=56"
"452","34.197616500","127.0.0.1","127.0.0.1","TCP","44","51405  >  5000 [ACK] Seq=65 Ack=456 Win=2160640 Len=0"
"453","35.141343400","127.0.0.1","127.0.0.1","TLSv1.2","125","Application Data"
"454","35.141373300","127.0.0.1","127.0.0.1","TCP","44","56384  >  56401 [ACK] Seq=4605 Ack=4002 Win=8257 Len=0"
"455","35.141520300","127.0.0.1","127.0.0.1","TLSv1.2","75","Application Data"
"456","35.141536200","127.0.0.1","127.0.0.1","TCP","44","56384  >  56401 [ACK] Seq=4605 Ack=4033 Win=8257 Len=0"
"457","35.141695500","127.0.0.1","127.0.0.1","TLSv1.2","105","Application Data"
"458","35.141717400","127.0.0.1","127.0.0.1","TCP","44","56401  >  56384 [ACK] Seq=4033 Ack=4666 Win=8370 Len=0"
"459","35.141744400","127.0.0.1","127.0.0.1","TLSv1.2","114","Application Data"
"460","35.141753300","127.0.0.1","127.0.0.1","TCP","44","56401  >  56384 [ACK] Seq=4033 Ack=4736 Win=8369 Len=0"
"461","35.805492000","127.0.0.1","127.0.0.1","TCP","104","51405  >  5000 [PSH, ACK] Seq=65 Ack=456 Win=2160640 Len=60"
"462","35.805519300","127.0.0.1","127.0.0.1","TCP","44","5000  >  51405 [ACK] Seq=456 Ack=125 Win=2161152 Len=0"
"463","35.805747600","127.0.0.1","127.0.0.1","TCP","104","5000  >  51408 [PSH, ACK] Seq=60 Ack=397 Win=2160896 Len=60"
"464","35.805766400","127.0.0.1","127.0.0.1","TCP","44","51408  >  5000 [ACK] Seq=397 Ack=120 Win=2161152 Len=0"
"465","35.998608000","127.0.0.1","127.0.0.1","TLSv1.2","170","Application Data"
"466","35.998630200","127.0.0.1","127.0.0.1","TCP","44","56051  >  50362 [ACK] Seq=911 Ack=1226 Win=8406 Len=0"
"467","35.998836400","127.0.0.1","127.0.0.1","TLSv1.2","75","Application Data"
"468","35.998849200","127.0.0.1","127.0.0.1","TCP","44","56051  >  50362 [ACK] Seq=911 Ack=1257 Win=8405 Len=0"
"469","35.998997000","127.0.0.1","127.0.0.1","TLSv1.2","105","Application Data"
"470","35.999017200","127.0.0.1","127.0.0.1","TCP","44","50362  >  56051 [ACK] Seq=1257 Ack=972 Win=8240 Len=0"
"471","35.999039100","127.0.0.1","127.0.0.1","TLSv1.2","113","Application Data"
"472","35.999045200","127.0.0.1","127.0.0.1","TCP","44","50362  >  56051 [ACK] Seq=1257 Ack=1041 Win=8240 Len=0"
"473","36.141501200","127.0.0.1","127.0.0.1","TLSv1.2","125","Application Data"
"474","36.141527100","127.0.0.1","127.0.0.1","TCP","44","56384  >  56401 [ACK] Seq=4736 Ack=4114 Win=8257 Len=0"
"475","36.141644100","127.0.0.1","127.0.0.1","TLSv1.2","75","Application Data"
"476","36.141659800","127.0.0.1","127.0.0.1","TCP","44","56384  >  56401 [ACK] Seq=4736 Ack=4145 Win=8256 Len=0"
"477","36.141812200","127.0.0.1","127.0.0.1","TLSv1.2","105","Application Data"
"478","36.141828600","127.0.0.1","127.0.0.1","TCP","44","56401  >  56384 [ACK] Seq=4145 Ack=4797 Win=8369 Len=0"
"479","36.141854800","127.0.0.1","127.0.0.1","TLSv1.2","114","Application Data"
"480","36.141862700","127.0.0.1","127.0.0.1","TCP","44","56401  >  56384 [ACK] Seq=4145 Ack=4867 Win=8369 Len=0"
"481","36.758922200","127.0.0.1","127.0.0.1","TCP","104","51405  >  5000 [PSH, ACK] Seq=125 Ack=456 Win=2160640 Len=60"
"482","36.758958500","127.0.0.1","127.0.0.1","TCP","44","5000  >  51405 [ACK] Seq=456 Ack=185 Win=2160896 Len=0"
"483","36.780112600","127.0.0.1","127.0.0.1","TCP","104","5000  >  51408 [PSH, ACK] Seq=120 Ack=397 Win=2160896 Len=60"
"484","36.780144300","127.0.0.1","127.0.0.1","TCP","44","51408  >  5000 [ACK] Seq=397 Ack=180 Win=2161152 Len=0"
"485","37.141016400","127.0.0.1","127.0.0.1","TLSv1.2","125","Application Data"
"486","37.141041100","127.0.0.1","127.0.0.1","TCP","44","56384  >  56401 [ACK] Seq=4867 Ack=4226 Win=8256 Len=0"
"487","37.141157100","127.0.0.1","127.0.0.1","TLSv1.2","75","Application Data"
"488","37.141172100","127.0.0.1","127.0.0.1","TCP","44","56384  >  56401 [ACK] Seq=4867 Ack=4257 Win=8256 Len=0"
"489","37.141372900","127.0.0.1","127.0.0.1","TLSv1.2","105","Application Data"
"490","37.141391400","127.0.0.1","127.0.0.1","TCP","44","56401  >  56384 [ACK] Seq=4257 Ack=4928 Win=8369 Len=0"
"491","37.141422800","127.0.0.1","127.0.0.1","TLSv1.2","114","Application Data"
"492","37.141431400","127.0.0.1","127.0.0.1","TCP","44","56401  >  56384 [ACK] Seq=4257 Ack=4998 Win=8368 Len=0"
"493","38.141938800","127.0.0.1","127.0.0.1","TLSv1.2","125","Application Data"
"494","38.141961400","127.0.0.1","127.0.0.1","TCP","44","56384  >  56401 [ACK] Seq=4998 Ack=4338 Win=8256 Len=0"
"495","38.142069200","127.0.0.1","127.0.0.1","TLSv1.2","75","Application Data"
"496","38.142082500","127.0.0.1","127.0.0.1","TCP","44","56384  >  56401 [ACK] Seq=4998 Ack=4369 Win=8256 Len=0"
"497","38.142288800","127.0.0.1","127.0.0.1","TLSv1.2","105","Application Data"
"498","38.142308000","127.0.0.1","127.0.0.1","TCP","44","56401  >  56384 [ACK] Seq=4369 Ack=5059 Win=8368 Len=0"
"499","38.142339100","127.0.0.1","127.0.0.1","TLSv1.2","114","Application Data"
"500","38.142347100","127.0.0.1","127.0.0.1","TCP","44","56401  >  56384 [ACK] Seq=4369 Ack=5129 Win=8368 Len=0"
"501","39.142385400","127.0.0.1","127.0.0.1","TLSv1.2","125","Application Data"
"502","39.142411700","127.0.0.1","127.0.0.1","TCP","44","56384  >  56401 [ACK] Seq=5129 Ack=4450 Win=8255 Len=0"
"503","39.142549700","127.0.0.1","127.0.0.1","TLSv1.2","75","Application Data"
"504","39.142566100","127.0.0.1","127.0.0.1","TCP","44","56384  >  56401 [ACK] Seq=5129 Ack=4481 Win=8255 Len=0"
"505","39.142724900","127.0.0.1","127.0.0.1","TLSv1.2","105","Application Data"
"506","39.142743400","127.0.0.1","127.0.0.1","TCP","44","56401  >  56384 [ACK] Seq=4481 Ack=5190 Win=8368 Len=0"
"507","39.142773400","127.0.0.1","127.0.0.1","TLSv1.2","114","Application Data"
"508","39.142781800","127.0.0.1","127.0.0.1","TCP","44","56401  >  56384 [ACK] Seq=4481 Ack=5260 Win=8367 Len=0"
